Company Name,Industry,Symbol,Series,ISIN Code
Beijing E-techstar Co. Ltd. Class A,Technology,300513.SZ,EQ,CNE1000027P1
Sichuan Newsnet Media (Group) Co. Ltd. Class A,Technology,300987.SZ,EQ,CNE100004KY6
Shanghai Rychen Technologies Co. Ltd. Class A,Technology,301273.SZ,EQ,CNE1000065T3
Shenzhen Zhongheng Huafa Co. Ltd. Class A,Technology,000020.SZ,EQ,CNE0000002V4
Shenzhen Zhongheng Huafa Co. Ltd. Class B,Technology,200020.SZ,EQ,CNE000000313
Sms Electric Co. Ltd. Class A,Technology,002857.SZ,EQ,CNE100002JP0
Jiangsu Yitong High-Tech Co. Ltd. Class A,Technology,300211.SZ,EQ,CNE1000012L2
Hangzhou SDIC Microelectronics Inc. Class A,Technology,688130.SS,EQ,CNE100005PZ9
Enjoyor Technology Co. Ltd. Class A,Technology,300020.SZ,EQ,CNE100000GM7
RocKontrol Technology Group Co. Ltd. Class A,Technology,688051.SS,EQ,CNE1000076Z7
Jiangxi Everbright Measurement & Control Technology Co. Ltd. Class A,Technology,300906.SZ,EQ,CNE1000048S1
Shenzhen Increase Technology Co. Ltd. Class A,Technology,300713.SZ,EQ,CNE100003571
Hangzhou Guotai Environmental Protection Technology Co. Ltd. Class A,Technology,301203.SZ,EQ,CNE1000061S4
Jiangsu Yunyong Electronics and Technology Co. Ltd. Class A,Technology,688060.SS,EQ,CNE1000078X8
Huizhong Instrumentation Co. Ltd. Class A,Technology,300371.SZ,EQ,CNE100001RB5
Jiangxi Hengda Hi-Tech Co. Ltd. Class A,Technology,002591.SZ,EQ,CNE1000014V7
Grand Kangxi Communication Technologies (Shanghai) Co. Ltd. Class A,Technology,688653.SS,EQ,CNE100006DQ2
Avcon Information Technology Co. Ltd. Class A,Technology,300074.SZ,EQ,CNE100000NM3
Shenzhen Sine Electric Co. Ltd. Class A,Technology,688395.SS,EQ,CNE1000052H6
XDC Industries (Shenzhen) Ltd. Class A,Technology,300615.SZ,EQ,CNE100002PP7
Shanghai Huaming Intelligent Terminal Equipment Co. Ltd. Class A,Technology,300462.SZ,EQ,CNE1000020G5
Shandong Teamgene Technology Co. Ltd. Class A,Technology,603151.SS,EQ,CNE100005NN0
Shijihengtong Technology Co. Ltd. Class A,Technology,301428.SZ,EQ,CNE1000062G7
Bangyan Technology Co. Ltd. Class A,Technology,688132.SS,EQ,CNE100005P49
Beijing Haohan Data Technology Co. Ltd. Class A,Technology,688292.SS,EQ,CNE1000068C3
Hangzhou Xili Intelligent Technology Co. Ltd. Class A,Technology,688616.SS,EQ,CNE1000053N2
Sichuan Hezong Medicine Easy-to-buy Pharmaceutical Co. Ltd. Class A,Technology,300937.SZ,EQ,CNE100004CV9
Shanghai Xinnanyang Only Education & Technology Co. Ltd. Class A,Technology,600661.SS,EQ,CNE0000005P9
G.tech Technology Ltd. Class A,Technology,301503.SZ,EQ,CNE100006533
Primeton Information Technologies. Inc. Class A,Technology,688118.SS,EQ,CNE1000076S2
Wuhan Citms Technology Co. Ltd. Class A,Technology,688038.SS,EQ,CNE100004P99
Hangzhou Hopechart IoT Technology Co. Ltd. Class A,Technology,688288.SS,EQ,CNE100003NM7
Zhejiang Prulde Electric Appliance Co. Ltd. Class A,Technology,301353.SZ,EQ,CNE100006236
Hengxin Shambala Culture Co. Ltd. Class A,Technology,300081.SZ,EQ,CNE100000PB1
Yarward Electronics Co Ltd Class A,Technology,301337.SZ,EQ,CNE100006228
Smartgiant Technology Co. Ltd. Class A,Technology,688115.SS,EQ,CNE1000078T6
Shenzhen Maxonic Automation Control Co. Ltd. Class A,Technology,300112.SZ,EQ,CNE100000SY7
Keysino Separation Technology Inc. Class A,Technology,300899.SZ,EQ,CNE100004892
Shanghai Information2 Software Inc. Class A,Technology,688435.SS,EQ,CNE100005VP8
WebRAY Tech Group Inc. Class A,Technology,688651.SS,EQ,CNE100007895
Zhengyuan Zhihui Group Co. Ltd. Class A,Technology,300645.SZ,EQ,CNE100002N77
Shanghai Dragonnet Technology Co. Ltd. Class A,Technology,300245.SZ,EQ,CNE1000015P6
Cloud Live Technology Group Co. Ltd. Class A,Technology,002306.SZ,EQ,CNE100000HG7
Wuhan Golden Laser Co. Ltd. Class A,Technology,300220.SZ,EQ,CNE100001344
Beijing Baolande Software Corporation Class A,Technology,688058.SS,EQ,CNE100003NV8
RoadMainT Co. Ltd. Class A,Technology,603860.SS,EQ,CNE100002WJ6
Anhui Jialiqi Advanced Composites Technology Co. Ltd. Class A,Technology,301586.SZ,EQ,CNE100006MC3
Hunan Copote Science and Technology Co. Ltd. Class A,Technology,600476.SS,EQ,CNE000001GC7
Hengfeng Information Technology Co. Ltd. Class A,Technology,300605.SZ,EQ,CNE100002PZ6
Beijing Longruan Technologies Inc. Class A,Technology,688078.SS,EQ,CNE1000076W4
Shandong Ouma Software Co. Ltd. Class A,Technology,301185.SZ,EQ,CNE100004YV3
Nanhua Instruments Co. Ltd. Class A,Technology,300417.SZ,EQ,CNE100001YD7
Beijing Bohui Science & Technology Co. Ltd. Class A,Technology,688004.SS,EQ,CNE100003ZQ2
But'one Information Corp. Xi'an Class A,Technology,600455.SS,EQ,CNE000001H29
Anhui Huaqi Environmental Protection & Technology Co. Ltd. Class A,Technology,300929.SZ,EQ,CNE100004CM8
Zhejiang Heda Technology Co. Ltd. Class A,Technology,688296.SS,EQ,CNE100004NY0
Hangzhou Gisway Information Technology Co. Ltd. Class A,Technology,301390.SZ,EQ,CNE1000062C6
Suzhou Agioe Technologies Co. Ltd. Class A,Technology,688450.SS,EQ,CNE100007887
KSEC Intelligent Technology Co. Ltd. Class A,Technology,301311.SZ,EQ,CNE1000062S2
Hunan Kylinsec Technology Co. Ltd. Class A,Technology,688152.SS,EQ,CNE100005TZ1
Integrity Technology Group Inc. Class A,Technology,688244.SS,EQ,CNE100005NP5
Shandong Cvicse Middleware Co. Ltd. Class A,Technology,688695.SS,EQ,CNE100006JW7
Chengdu Screen Microelectronics Co. Ltd. Class A,Technology,688053.SS,EQ,CNE100005Q97
Nanjing Putian Telecommunications Co. Ltd. Class B,Technology,200468.SZ,EQ,CNE000000Q60
Wintao Communications Co. Ltd. Class A,Technology,301139.SZ,EQ,CNE100005GR5
Guandian Defense Technology Co. Ltd. Class A,Technology,688287.SS,EQ,CNE100005QR4
SHANDONG CHUNGUANG TECHNOLOGY GROUP,Technology,301531.SZ,EQ,
SHENZHEN CSL VACUUM SCI & TECH CO,Technology,688785.SS,EQ,
Goode EIS (Suzhou) Corp Ltd Class A,Technology,301680.SZ,EQ,CNE100007JD5
MetaX Integrated Circuits (Shanghai) Co. Ltd. Class A,Technology,688802.SS,EQ,CNE100007D90
Bescient Technologies Co. Ltd. Class A,Technology,688671.SS,EQ,CNE1000078C2
WUHAN CHANGJIN PHOTONICS TECH CO,Technology,688635.SS,EQ,
CSG Digital Power Grid Research Institute Co. Ltd. Class A,Technology,301638.SZ,EQ,CNE100007CQ2
Xiamen Hengkun New Material Technology Co. Ltd. Class A,Technology,688727.SS,EQ,CNE100007D58
Shimeng Supply Chain Management Co. Ltd. Class A,Technology,001220.SZ,EQ,CNE100007GZ4
SJ SEMICONDUCTOR CORPORATION,Technology,688820.SS,EQ,
ICkey (Shanghai) Internet & Technology Co. Ltd. Class A,Technology,301563.SZ,EQ,CNE100007994
Dynamic Electronics Co Ltd Class A,Technology,603175.SS,EQ,CNE1000078P4
Chengdu Hongming Electronics Co. Ltd. Class A,Technology,301682.SZ,EQ,CNE100007KS1
DapuStor Corporation Class A,Technology,301666.SZ,EQ,CNE100007KX1
XIAMEN UX IC CO LTD.,Technology,688807.SS,EQ,
Beijing OnMicro Electronics Co. Ltd. Class A,Technology,688790.SS,EQ,CNE100007D82
RNBC New Energy Co. Ltd. Class A,Technology,301667.SZ,EQ,CNE100007G55
ISVISION HANGZHOU TECHNOLOGY CO LTD,Technology,688816.SS,EQ,
Nanchang Sanrui Intelligence Technology Co. Ltd. Class A,Technology,301696.SZ,EQ,CNE100007KW3
Moore Threads Technology Co. Ltd. Class A,Technology,688795.SS,EQ,CNE100007D66
JIANGXI REDBOARD TECH CO LTD,Technology,603459.SS,EQ,
SEEYA TECHNOLOGY CORPORATION,Technology,688781.SS,EQ,
MAXONE SEMICONDUCTOR SUZHOU CO LTD,Technology,688809.SS,EQ,
SEMIGHT INSTRUMENTS CO LTD,Technology,688808.SS,EQ,
