Company Name,Industry,Symbol,Series,ISIN Code
Suzhou Wanxiang Technology Co. Ltd. Class A,Technology,301180.SZ,EQ,CNE100004YT7
Zhejiang MTCN Technology Co. Ltd. Class A,Technology,003026.SZ,EQ,CNE1000049M2
Daheng New Epoch Technology Inc. Class A,Technology,600288.SS,EQ,CNE0000015K9
Xi'an ChenXi Aviation Technology Corp. Ltd. Class A,Technology,300581.SZ,EQ,CNE100002F10
Kewell Technology Co. Ltd. Class A,Technology,688551.SS,EQ,CNE100004322
Chutian Dragon Co. Ltd. Class A,Technology,003040.SZ,EQ,CNE100004FY6
Foshan Blue Rocket Electronics Co. Ltd. Class A,Technology,301348.SZ,EQ,CNE1000066C7
Qingdao Eastsoft Communication Technology Co. Ltd. Class A,Technology,300183.SZ,EQ,CNE1000010C5
Ucap Cloud Information Technology Co. Ltd. Class A,Technology,688228.SS,EQ,CNE100007721
Harbin Xinguang Optic-Electronics Technology Co. Ltd. Class A,Technology,688011.SS,EQ,CNE100003MT4
Vanjee Technology Co. Ltd. Class A,Technology,300552.SZ,EQ,CNE100002D79
Fujian Forecam Optics Co. Ltd. Class A,Technology,688010.SS,EQ,CNE100003MV0
Talant Optronics (suzhou) Co. Ltd. Class A,Technology,301045.SZ,EQ,CNE100004Q07
Shenzhen Infinova Ltd. Class A,Technology,002528.SZ,EQ,CNE100000Y50
BZS (Beijing) Technology Development Co. Ltd. Class A,Technology,603082.SS,EQ,CNE100006JN6
UniTTEC Co. Ltd. Class A,Technology,000925.SZ,EQ,CNE000000Z93
Guangdong Champion Asia Electronics Co. Ltd. Class A,Technology,603386.SS,EQ,CNE100002VT7
Chipsea Technologies Shenzhen Corp. Ltd. Class A,Technology,688595.SS,EQ,CNE1000042K1
Rastar Group Class A,Technology,300043.SZ,EQ,CNE100000KN7
Beijing UniStrong Science & Technology Co. Ltd. Class A,Technology,002383.SZ,EQ,CNE100000MY0
Hangzhou Shenhao Technology Co. Ltd. Class A,Technology,300853.SZ,EQ,CNE100004140
Youon Technology Co. Ltd. Class A,Technology,603776.SS,EQ,CNE100002W92
B-Soft Co. Ltd. Class A,Technology,300451.SZ,EQ,CNE100001ZG7
Suzhou Etron Technologies Co. Ltd. Class A,Technology,603380.SS,EQ,CNE100002QT7
Mingchen Health Co. Ltd. Class A,Technology,002919.SZ,EQ,CNE1000033B9
Shenzhen Refond Optoelectronics Co. Ltd. Class A,Technology,300241.SZ,EQ,CNE1000015G5
Asiainfo Security Technologies Co. Ltd. Class A,Technology,688225.SS,EQ,CNE100005R62
Sichuan Jiuyuan Yinhai Software Co Ltd Class A,Technology,002777.SZ,EQ,CNE1000024L7
Doushen (Beijing) Education & Technology Inc. Class A,Technology,300010.SZ,EQ,CNE100000GX4
Raisecom Technology Co. Ltd. Class A,Technology,603803.SS,EQ,CNE100002RC1
Highbroad Advanced Material (Hefei) Co. Ltd. Class A,Technology,301321.SZ,EQ,CNE100006WB4
Beijing Philisense Technology Co. Ltd. Class A,Technology,300287.SZ,EQ,CNE100001BD5
Hansong (Nanjing) Technology Limited Class A,Technology,301491.SZ,EQ,CNE1000074J6
Jiangsu Transimage Technology Co. Ltd. Class A,Technology,002866.SZ,EQ,CNE100002QK6
Guangxi Xinxunda Technology Group Co. Ltd. Class A,Technology,300518.SZ,EQ,CNE1000027S5
Uroica Precision Information Engineering Co. Ltd. Class A,Technology,300099.SZ,EQ,CNE100000S82
Beijing Bayi Space LCD Technology Co. Ltd. Class A,Technology,688181.SS,EQ,CNE100003RZ0
Shenzhen EXC-LED Technology Co. Ltd. Class A,Technology,300889.SZ,EQ,CNE100004801
Zhejiang Shengyang Science & Technology Co. Ltd. Class A,Technology,603703.SS,EQ,CNE1000022M9
Costar Group Co. Ltd. Class A,Technology,002189.SZ,EQ,CNE100000882
Shenzhen Bingchuan Network Co. Ltd. Class A,Technology,300533.SZ,EQ,CNE100002CN0
Qingmu Tec Co. Ltd. Class A,Technology,301110.SZ,EQ,CNE1000058B6
GHT Co. Ltd. Class A,Technology,300711.SZ,EQ,CNE100003555
Changzhou Aohong Electronics Co. Ltd. Class A,Technology,605058.SS,EQ,CNE100007762
Foshan Nationstar Optoelectronics Co. Ltd Class A,Technology,002449.SZ,EQ,CNE100000RM4
Wuhan Xingtu Xinke Electronics Co. Ltd. Class A,Technology,688081.SS,EQ,CNE100003RY3
Shenzhen Minde Electronics Technology Ltd. Class A,Technology,300656.SZ,EQ,CNE100002NX6
Sunyard Technology Co. Ltd. Class A,Technology,600571.SS,EQ,CNE000001CZ7
Sichuan Discovery Dream Science & Technology Co. Ltd. Class A,Technology,301213.SZ,EQ,CNE100005550
Guangzhou Hi-Target Navigation Tech Co. Ltd. Class A,Technology,300177.SZ,EQ,CNE100001039
Inner Mongolia OJing Science and Technology Co. Ltd. Class A,Technology,001269.SZ,EQ,CNE100005KT3
Sichuan Tianyi Comheart Telecom Co. Ltd. Class A,Technology,300504.SZ,EQ,CNE1000033V7
Beijing ConST Instruments Technology Inc. Class A,Technology,300445.SZ,EQ,CNE100001Z82
Ningbo Techmation Co. Ltd. Class A,Technology,603015.SS,EQ,CNE100001TZ0
Changzhou Galaxy Century Microelectronics Co. Ltd. Class A,Technology,688689.SS,EQ,CNE100004BW9
Yonyou Auto Information Technology (Shanghai) Co. Ltd. Class A,Technology,688479.SS,EQ,CNE1000060P2
Careray Digital Medical Technology Co. Ltd. Class A,Technology,688607.SS,EQ,CNE100004BR9
Linewell Software Co Ltd Class A,Technology,603636.SS,EQ,CNE100001VK8
Sun-Create Electronics Co. Ltd Class A,Technology,600990.SS,EQ,CNE000001HJ0
Shandong New Beiyang Information Technology Co. Ltd. Class A,Technology,002376.SZ,EQ,CNE100000M62
Phenix Optics Co. Ltd. Class A,Technology,600071.SS,EQ,CNE000000QJ3
Yunnan Nantian Electronics Information Co. Ltd. Class A,Technology,000948.SZ,EQ,CNE0000010M6
Zhejiang Shuangyuan Technology Co. Ltd Class A,Technology,688623.SS,EQ,CNE100007838
Huasu Holdings Co. Ltd. Class A,Technology,000509.SZ,EQ,CNE0000001G7
Beijing Vastdata Technology Co. Ltd. Class A,Technology,603138.SS,EQ,CNE100002YM6
Huawen Media Group Class A,Technology,000793.SZ,EQ,CNE0000002L5
Yutong Heavy Industries Co. Ltd. Class A,Technology,600817.SS,EQ,CNE000000G47
Jiangxi Firstar Panel Technology Co. Ltd. Class A,Technology,300256.SZ,EQ,CNE1000016B4
Beken Corp. Class A,Technology,603068.SS,EQ,CNE100003LL3
Shenzhen Rapoo Technology Co. Ltd. Class A,Technology,002577.SZ,EQ,CNE1000012J6
Urovo Technology Co. Ltd. Class A,Technology,300531.SZ,EQ,CNE100002CL4
Chengdu M&S Electronics Technology Co. Ltd. Class A,Technology,688311.SS,EQ,CNE100005X72
Zhejiang TOP Cloud-agri Technology Co. Ltd. Class A,Technology,301556.SZ,EQ,CNE100006P22
Shenzhen Txd Technology Co. Ltd. Class A,Technology,002845.SZ,EQ,CNE100002K13
Shanghai Holystar Information Technology Co. Ltd. Class A,Technology,688330.SS,EQ,CNE100005XB4
Guangzhou KingTeller Technology Co. Ltd. Class A,Technology,002177.SZ,EQ,CNE1000007R9
Haoyun Technologies Co. Ltd. Class A,Technology,300448.SZ,EQ,CNE100001ZC6
Ronglian Group Ltd. Class A,Technology,002642.SZ,EQ,CNE1000019S2
NSFOCUS Technologies Group Co. Ltd. Class A,Technology,300369.SZ,EQ,CNE100001S32
Beijing JCZ Technology Co. Ltd. Class A,Technology,688291.SS,EQ,CNE100005NL4
Hebei Huijin Group Co. Ltd. Class A,Technology,300368.SZ,EQ,CNE100001RC3
Shandong Senter Electronic Co. Ltd. Class A,Technology,001388.SZ,EQ,CNE1000071J2
Shanghai Ruking Technologies Co. Ltd. Class A,Technology,301525.SZ,EQ,CNE1000068R1
Shenzhen Longli Technology Co. Ltd. Class A,Technology,300752.SZ,EQ,CNE100003FT8
ZhongYeDa Electric Co. Ltd. Class A,Technology,002441.SZ,EQ,CNE100000QZ8
Goldcard Smart Group Co Ltd Class A,Technology,300349.SZ,EQ,CNE100001KX4
Beijing ZZNode Technologies Co. Ltd. Class A,Technology,003007.SZ,EQ,CNE1000046T3
Beijing Global Safety Technology Co. Ltd. Class A,Technology,300523.SZ,EQ,CNE100002813
SGSG Science & Technology Co. Ltd. Zhuhai Class A,Technology,300561.SZ,EQ,CNE100002DH0
Inspur Software Co. Ltd. Class A,Technology,600756.SS,EQ,CNE000000M49
Changchun Zhiyuan New Energy Equipment Co. Ltd. Class A,Technology,300985.SZ,EQ,CNE100004KW0
NanJing GOVA Technology Co. Ltd. Class A,Technology,688539.SS,EQ,CNE1000060D8
Guangzhou Anyka Microelectronics Co. Ltd. Class A,Technology,688620.SS,EQ,CNE100007846
Beijing StarNeto Technology Corp. Ltd. Class A,Technology,002829.SZ,EQ,CNE100002K62
Shenzhen Jieshun Science & Technology Industry Co. Ltd. Class A,Technology,002609.SZ,EQ,CNE1000016J7
ENC Digital Technology Co. Ltd. Class A,Technology,603869.SS,EQ,CNE1000022C0
Hangzhou Star Shuaier Electric Appliance Co. Ltd. Class A,Technology,002860.SZ,EQ,CNE100002JL9
Guangdong Misun Technology Co. Ltd. Class A,Technology,301577.SZ,EQ,CNE100006FL8
Bestlink Technologies Co. Ltd. Class A,Technology,603206.SS,EQ,CNE100005QW4
Guangdong Green Precision Components Co. Ltd. Class A,Technology,300968.SZ,EQ,CNE100004KC2
Shenzhen Kiwi Instruments Co. Ltd. Class A,Technology,688045.SS,EQ,CNE100005QQ6
Minami Acoustics Limited Class A,Technology,301383.SZ,EQ,CNE1000064S8
Wuhan Ligong Guangke Co. Ltd. Class A,Technology,300557.SZ,EQ,CNE100002DC1
Wanma Technology Co. Ltd. Class A,Technology,300698.SZ,EQ,CNE1000034S1
YaGuang Technology Group Co. Ltd. Class A,Technology,300123.SZ,EQ,CNE100000V38
Anhui Ronds Science & Technology Inc. Co. Class A,Technology,688768.SS,EQ,CNE100004P16
Hangzhou Arcvideo Technology Co. Ltd. Class A,Technology,688039.SS,EQ,CNE1000076V6
Fujian Start Group Co. Ltd. Class A,Technology,600734.SS,EQ,CNE000000LS5
Shenzhen CDL Precision Technology Co. Ltd. Class A,Technology,300686.SZ,EQ,CNE1000034F8
COSCO SHIPPING Technology Co Ltd Class A,Technology,002401.SZ,EQ,CNE100000P28
Shenzhen Vapel Power Supply Technology Co. Ltd. Class A,Technology,301516.SZ,EQ,CNE100006CN1
Zhuhai Comleader Information Science & Technology Co. Ltd. Class A,Technology,688175.SS,EQ,CNE1000059T6
Zhejiang Wellsun Intelligent Technology Co. Ltd. Class A,Technology,300882.SZ,EQ,CNE1000047T1
Beijing Advanced Digital Technology Co. Ltd. Class A,Technology,300541.SZ,EQ,CNE100002CX9
Donghua Testing Technology Co. Ltd. Class A,Technology,300354.SZ,EQ,CNE100001P19
Chengdu KSW Technologies Co. Ltd. Class A,Technology,688283.SS,EQ,CNE100005R54
Shenzhen Sunwin Intelligent Co. Ltd. Class A,Technology,300044.SZ,EQ,CNE100000KM9
Tatwah Smartech Co. Ltd. Class A,Technology,002512.SZ,EQ,CNE100000XN0
Beijing Thunisoft Corporation Limited Class A,Technology,300271.SZ,EQ,CNE000001QM5
Beijing VRV Software Co. Ltd. Class A,Technology,300352.SZ,EQ,CNE100001P43
ShenZhen Longtu Photomask Co. Ltd.Class A,Technology,688721.SS,EQ,CNE100006N40
Jiawei Renewable Energy Co. Ltd. Class A,Technology,300317.SZ,EQ,CNE100001DK6
Singatron Electronic (China) Co. Ltd. Class A,Technology,301329.SZ,EQ,CNE1000064M1
Fujian Rongji Software Co. Ltd. Class A,Technology,002474.SZ,EQ,CNE100000TQ1
Feitian Technologies Co. Ltd. Class A,Technology,300386.SZ,EQ,CNE100001XJ6
Chengdu Jiafaantai Education Technology Co. Ltd. Class A,Technology,300559.SZ,EQ,CNE100002DF4
Invengo Information Technology Co. Ltd. Class A,Technology,002161.SZ,EQ,CNE1000006G4
New Trend International Logis-Tech Co. Ltd. Class A,Technology,300532.SZ,EQ,CNE100002CM2
Saimo Technology Co. Ltd. Class A,Technology,300466.SZ,EQ,CNE1000021M1
Beijing Jiaxun Feihong Electrical Co. Ltd. Class A,Technology,300213.SZ,EQ,CNE1000012N8
Koal Software Co. Ltd. Class A,Technology,603232.SS,EQ,CNE100002XS5
Shanghai Hollywave Electronic System Co. Ltd. Class A,Technology,688682.SS,EQ,CNE1000052R5
Shenzhen Bestek Technology Co. Ltd. Class A,Technology,300822.SZ,EQ,CNE100003SJ2
Pansoft Co Ltd Class A,Technology,300996.SZ,EQ,CNE100004L69
Inventronics (Hangzhou) Inc. Class A,Technology,300582.SZ,EQ,CNE100002F28
Union Optech Co. Ltd. Class A,Technology,300691.SZ,EQ,CNE1000034L6
Yingkou Jinchen Machinery Co. Ltd. Class A,Technology,603396.SS,EQ,CNE100002V85
Zhejiang Whyis Technology Co. Ltd. Class A,Technology,301218.SZ,EQ,CNE1000058M3
Anhui Landun Photoelectron Co. Ltd. Class A,Technology,300862.SZ,EQ,CNE100004769
Ningbo Jianan Electronics Co. Ltd. Class A,Technology,300880.SZ,EQ,CNE1000047R5
Gresgying Digital Energy Technology Co. Ltd. Class A,Technology,600212.SS,EQ,CNE000001014
Shanghai Amarsoft Information & Technology Co. Ltd. Class A,Technology,300380.SZ,EQ,CNE100001RK6
Shanghai Hi-Tech Control System Co. Ltd. Class A,Technology,002184.SZ,EQ,CNE100000809
Guangdong Weide Information Technology Co. Ltd. Class A,Technology,688171.SS,EQ,CNE100005R70
Integrated Electronic Systems Lab Co. Ltd. Class A,Technology,002339.SZ,EQ,CNE100000KV0
Leon Technology Co. Ltd. Class A,Technology,300603.SZ,EQ,CNE100002Q17
Ways Electron Co. Ltd. Class A,Technology,605218.SS,EQ,CNE1000042L9
JinXianDai Information Industry Co. Ltd. Class A,Technology,300830.SZ,EQ,CNE100003T13
Triductor Technology (Suzhou) Inc. Class A,Technology,688259.SS,EQ,CNE100005RG5
DBAPPSecurity Co. Ltd. Class A,Technology,688023.SS,EQ,CNE100003NT2
Bonree Data Technology Co. Ltd. Class A,Technology,688229.SS,EQ,CNE100004405
Shanghai Newtouch Software Co. Ltd. Class A,Technology,688590.SS,EQ,CNE100006ZF8
Guangdong Fangyuan New Materials Group Co. Ltd. Class A,Technology,688148.SS,EQ,CNE100004NP8
Maxic Technology Inc. Class A,Technology,688458.SS,EQ,CNE100005ZG8
Linkage Software Co. Ltd. Class A,Technology,688588.SS,EQ,CNE100004058
Winner Technology Co. Inc. Class A,Technology,300609.SZ,EQ,CNE100002PV5
Sansec Technology Co. Ltd. Class A,Technology,688489.SS,EQ,CNE100005V74
Beijing Beetech Inc. Class A,Technology,300667.SZ,EQ,CNE100002NM9
SmartGen (Zhengzhou) Technology Co. Ltd. Class A,Technology,301361.SZ,EQ,CNE1000065J4
Newcapec Electronics Co. Ltd. Class A,Technology,300248.SZ,EQ,CNE1000015W2
SZZT Electronics Co. Ltd. Class A,Technology,002197.SZ,EQ,CNE1000008N6
Shanghai Golden Bridge Info Tech Co. Ltd. Class A,Technology,603918.SS,EQ,CNE100002300
Shanghai Aohua Photoelectricity Endoscope Co. Ltd. Class A,Technology,688212.SS,EQ,CNE100004ZJ5
Wiscom System Co. Ltd. Class A,Technology,002090.SZ,EQ,CNE000001PM7
Wuhan KOTEI Informatics Co. Ltd. Class A,Technology,301221.SZ,EQ,CNE1000057B8
Beijing Quanshi World Online Network Information Co. Ltd. Class A,Technology,002995.SZ,EQ,CNE1000040R0
Hangzhou Yitong New Materials Co. Ltd. Class A,Technology,300930.SZ,EQ,CNE100004CN6
Yes Optoelectronics (Group) Co. Ltd. Class A,Technology,002952.SZ,EQ,CNE100003JP8
Shanghai New Centurion Network Information Technology Co. Ltd. Class A,Technology,605398.SS,EQ,CNE100004BZ2
Hanwang Technology Co. Ltd. Class A,Technology,002362.SZ,EQ,CNE100000LW6
Ji'an Mankun Technology Co. Ltd. Class A,Technology,301132.SZ,EQ,CNE100005JN8
Lians Technology Co. Ltd. Class A,Technology,300051.SZ,EQ,CNE100000LJ3
HuangShan Googe Co. Ltd. Class A,Technology,301581.SZ,EQ,CNE100006S60
Hangzhou Prevail Optoelectronic Equipment Co. Ltd. Class A,Technology,300710.SZ,EQ,CNE100003548
Red Phase Inc. Class A,Technology,300427.SZ,EQ,CNE100001YN6
Beijing Huaru Technology Co. Ltd. Class A,Technology,301302.SZ,EQ,CNE100005DZ5
Keystone Technology Co. Ltd. Class A,Technology,605588.SS,EQ,CNE1000050R9
Shenzhen Australis Electronic Technology Co. Ltd. Class A,Technology,300940.SZ,EQ,CNE100004CY3
H&R Century Union Corp. Class A,Technology,000892.SZ,EQ,CNE000000XX0
SI-TECH Information Technology Co. Ltd. Class A,Technology,300608.SZ,EQ,CNE100002PW3
Bright Oceans Inter-Telecom Corp. Class A,Technology,600289.SS,EQ,CNE000001220
Ningbo Ligong Environment and Energy Technology Co. Ltd. Class A,Technology,002322.SZ,EQ,CNE100000J18
Jiangxi Tianli Technology Inc. Class A,Technology,300399.SZ,EQ,CNE100001XW9
Anhui Wantong Technology Co. Ltd. Class A,Technology,002331.SZ,EQ,CNE100000JV2
3onedata Co. Ltd. Class A,Technology,688618.SS,EQ,CNE1000077R2
Fuchun Technology Co. Ltd. Class A,Technology,300299.SZ,EQ,CNE100001CK8
Beijing Trustfar Technology Co. Ltd. Class A,Technology,300231.SZ,EQ,CNE100001427
Hangzhou Huasu Technology Co. Ltd. Class A,Technology,301157.SZ,EQ,CNE1000061R6
Brilliance Technology Co. Ltd. Class A,Technology,300542.SZ,EQ,CNE100002CY7
HCR Co. Ltd. Class A,Technology,688500.SS,EQ,CNE1000041Y4
Joyware Electronics Co. Ltd. Class A,Technology,300270.SZ,EQ,CNE100001906
Shanghai Laimu Electronics Co. Ltd. Class A,Technology,603633.SS,EQ,CNE100003084
Beijing Deep Glint Technology Co. Ltd. Class A,Technology,688207.SS,EQ,CNE1000059S8
China Post Technology Co. Ltd. Class A,Technology,688648.SS,EQ,CNE100006DP4
Hangzhou Century Co. Ltd. Class A,Technology,300078.SZ,EQ,CNE100000NV4
YLZ Information Technology Co. Ltd. Class A,Technology,300096.SZ,EQ,CNE100000RZ6
Heren Health Co. Ltd. Class A,Technology,300550.SZ,EQ,CNE100002D53
Sinosun Technology Co. Ltd. Class A,Technology,300333.SZ,EQ,CNE100001H50
Henan Splendor Science and Technology Co. Ltd. Class A,Technology,002296.SZ,EQ,CNE100000FZ1
Client Service International Inc. Class A,Technology,300663.SZ,EQ,CNE100002NH9
China Chippacking Technology Co. Ltd. Class A,Technology,688216.SS,EQ,CNE100005113
Troy Information Technology Co. Ltd. Class A,Technology,300366.SZ,EQ,CNE100001RX9
BizConf Technology Co. Ltd. Class A,Technology,300578.SZ,EQ,CNE100002MV2
Chengdu Jouav Automation Tech Co. Ltd. Class A,Technology,688070.SS,EQ,CNE1000077V4
Anhui Wanyi Science And Technology Co. Ltd. Class 1,Technology,688600.SS,EQ,CNE100004264
Memsensing Microsystems (Suzhou China) Co. Ltd. Class A,Technology,688286.SS,EQ,CNE100004488
Changzhou Shichuang Energy Co. Ltd. Class A,Technology,688429.SS,EQ,CNE100006QJ9
Ningbo Bird Co. Ltd. Class A,Technology,600130.SS,EQ,CNE0000013F4
Jinlong Machinery & Electronic Co. Ltd. Class A,Technology,300032.SZ,EQ,CNE100000JF5
Xinjiang Sailing Information Technology Co. Ltd. Class A,Technology,300588.SZ,EQ,CNE100002F85
Beijing Bewinner Communications Co. Ltd. Class A,Technology,002148.SZ,EQ,CNE100000676
Dareway Intelligent Technology Co. Ltd Class A,Technology,688579.SS,EQ,CNE1000041V0
Hi-Trend Technology (Shanghai) Co. Ltd. Class A,Technology,688391.SS,EQ,CNE100005PB0
Shenzhen Zowee Tech Co. Ltd. Class A,Technology,002369.SZ,EQ,CNE100000MN3
Jiangsu Rijiu Optoelectronics Jointstock Co. Ltd. Class A,Technology,003015.SZ,EQ,CNE100004710
Zhejiang NetSun Co. Ltd. Class A,Technology,002095.SZ,EQ,CNE000001PT2
Zhongjin Irradiation Incorporated Company Class A,Technology,300962.SZ,EQ,CNE100004K78
Surfilter Network Technology Co. Ltd. Class A,Technology,300311.SZ,EQ,CNE100001D54
Fullink Technology Co. Ltd. Class A,Technology,301067.SZ,EQ,CNE100004RN4
Shenzhen Fangzhi Science and Technology Co. Ltd. Class A,Technology,300235.SZ,EQ,CNE100001559
Shenzhen King Brother Electronics Technology Co. Ltd. Class A,Technology,301041.SZ,EQ,CNE100004NJ1
Beijing Jingyeda Technology Co. Ltd. Class A,Technology,003005.SZ,EQ,CNE1000046R7
Shanghai Welltech Automation Co. Ltd. Class A,Technology,002058.SZ,EQ,CNE000001N96
Wuxi Hodgen Technology Co. Ltd. Class A,Technology,300279.SZ,EQ,CNE100001B15
Piesat Information Technology Co. Ltd. Class A,Technology,688066.SS,EQ,CNE100003M69
Jilin University Zhengyuan Information Technologies Co. Ltd. Class A,Technology,003029.SZ,EQ,CNE1000049N0
Guangdong TianYiMa Information Industry Co. Ltd. Class A,Technology,301178.SZ,EQ,CNE100004YS9
Shenzhen Sinovatio Technology Co. Ltd. Class A,Technology,002912.SZ,EQ,CNE100003340
Beijing Transtrue Technology Inc Class A,Technology,002771.SZ,EQ,CNE1000021S8
Shenzhen ZQgame Co. Ltd. Class A,Technology,300052.SZ,EQ,CNE100000LK1
Sunsea AIoT Technology Co. Ltd. Class A,Technology,002313.SZ,EQ,CNE100000HR4
Hunan Creator Information Technologies Co. Ltd. Class A,Technology,300730.SZ,EQ,CNE1000035P4
Guiyang Longmaster Information & Technology Co. Ltd. Class A,Technology,300288.SZ,EQ,CNE100001C14
Shanghai Sk Petroleum & Chemical Equipment Corporation Ltd Class A,Technology,002278.SZ,EQ,CNE100000F53
Hangzhou CNCR-IT Co. Ltd. Class A,Technology,300250.SZ,EQ,CNE100001609
Shanghai WonderTek Software Corp. Ltd. Class A,Technology,603189.SS,EQ,CNE1000030M2
AVIT Ltd. Class A,Technology,300264.SZ,EQ,CNE1000016W0
Beijing Emerging Eastern Aviation Equipment Co. Ltd. Class A,Technology,002933.SZ,EQ,CNE100003GJ7
Shanghai Orient-Chip Technology Co. Ltd. Class A,Technology,688061.SS,EQ,CNE100005NR1
Jiangsu Smartwin Electronics Technology Co. Ltd. Class A,Technology,301106.SZ,EQ,CNE1000056P0
Kairuide Holding Co. Ltd. Class A,Technology,002072.SZ,EQ,CNE000001NW1
Hangzhou Electronic Soul Network Technology Co. Ltd. Class A,Technology,603258.SS,EQ,CNE100002GB6
Sichuan Tianwei Electronic Co. Ltd. Class A,Technology,688511.SS,EQ,CNE100004NT0
Tianjin Jieqiang Power Equipment Co. Ltd. Class A,Technology,300875.SZ,EQ,CNE1000047L8
Hollyland (China) Electronics Technology Corp Ltd Class A,Technology,002729.SZ,EQ,CNE100001WL4
Shenzhen Genvict Technologies Co. Ltd. Class A,Technology,002869.SZ,EQ,CNE100002QG4
Hefei Gocom Information Technology Co. Ltd. Class A,Technology,688367.SS,EQ,CNE1000050X7
Xingyuan Environment Technology Co. Ltd. Class A,Technology,300266.SZ,EQ,CNE100001773
Rongcheer Industrial Technology (Suzhou) Co. Ltd. Class A,Technology,301360.SZ,EQ,CNE100006251
Nanjing Huamai Technology Co. Ltd. Class A,Technology,603042.SS,EQ,CNE100002FT0
Beijing Yupont Electric Power Technology Co. Ltd. Class A,Technology,688597.SS,EQ,CNE100005162
Beijing Labtech Instruments Co. Ltd. Class A,Technology,688056.SS,EQ,CNE1000043C6
Chase Science Co. Ltd. Class A,Technology,300941.SZ,EQ,CNE100004CZ0
NanJing Institute of Surveying Mapping and Geotechnical Investigation Co. Ltd. Class A,Technology,300826.SZ,EQ,CNE100003SX3
Senba Sensing Technology Co. Ltd. Class A,Technology,300701.SZ,EQ,CNE1000034W3
Zhejiang East Crystal Electronic Co. Ltd. Class A,Technology,002199.SZ,EQ,CNE1000008Q9
Ropeok Technology Group Co. Ltd. Class A,Technology,688619.SS,EQ,CNE100005451
Beijing Andawell Science & Technology Co. Ltd. Class A,Technology,300719.SZ,EQ,CNE1000035D0
Guangdong Tecsun Science & Technology Co. Ltd. Class A,Technology,002908.SZ,EQ,CNE100003316
ComNav Technology Ltd. Class A,Technology,688592.SS,EQ,CNE1000078D0
EGing Photovoltaic Technology Co. Ltd. Class A,Technology,600537.SS,EQ,CNE000001DF7
Shenzhen Emperor Technology Co. Ltd. Class A,Technology,300546.SZ,EQ,CNE100002D12
Zerun Co. Ltd. Class A,Technology,301636.SZ,EQ,CNE100006YN5
Suzhou Future Electrical Co. Ltd. Class A,Technology,301386.SZ,EQ,CNE100006293
Chengdu Tianjian Technology Co. Ltd. Class A,Technology,002977.SZ,EQ,CNE100003S55
Weihai Huadong Automation Co. Ltd. Class A,Technology,002248.SZ,EQ,CNE100000BZ0
Beijing Hanbang Technology Corp. Class A,Technology,300449.SZ,EQ,CNE100001ZD4
Gstarsoft Co. Ltd. Class A,Technology,688657.SS,EQ,CNE100006DJ7
Beijing Forever Technology Co. Ltd. Class A,Technology,300365.SZ,EQ,CNE100001RD1
Shanghai Wisdom Information Technology Co. Ltd. Class A,Technology,301315.SZ,EQ,CNE1000064J7
Shenzhen Fluence Technology Plc Class A,Technology,300647.SZ,EQ,CNE100002NC0
Beijing InHand Networks Technology Co. Ltd Class A,Technology,688080.SS,EQ,CNE100003RG0
Beijing Hengyu Datacom Aviation Equipment Co. Ltd. Class A,Technology,300965.SZ,EQ,CNE100004GC0
Jiangsu Skyray Instrument Co. Ltd. Class A,Technology,300165.SZ,EQ,CNE100000Z91
Jiangsu Xiehe Electronic Co. Ltd. Class A,Technology,605258.SS,EQ,CNE1000077J9
Zhengzhou Jiean Hi-tech Co. Ltd. Class A,Technology,300845.SZ,EQ,CNE1000040W0
ChinaEtek Service and Technology Co. Ltd. Class A,Technology,301208.SZ,EQ,CNE100005GT1
Hillstone Networks Co. Ltd. Class A,Technology,688030.SS,EQ,CNE100003P66
Tangel Culture Co. Ltd. Class A,Technology,300148.SZ,EQ,CNE100000YB3
QingCloud Technologies Corp Class A,Technology,688316.SS,EQ,CNE1000053Q5
Beilong Precision Technology Co. Ltd. Class A,Technology,301567.SZ,EQ,CNE100006D67
Hangzhou Everfine Photo-E-Info Co. Ltd. Class A,Technology,300306.SZ,EQ,CNE100001CS1
Leaguer (Shenzhen) Microelectronics Corp. Class A,Technology,688589.SS,EQ,CNE1000041N7
Shenzhen Tvt Digital Technology Co. Ltd. Class A,Technology,002835.SZ,EQ,CNE100002C96
Synthesis Electronic Technology Co. Ltd. Class A,Technology,300479.SZ,EQ,CNE1000020Y8
Clenergy Technology Co. Ltd. Class A,Technology,603628.SS,EQ,CNE100002G27
Shanghai W-Ibeda High Tech.Group Co. Ltd. Class A,Technology,688071.SS,EQ,CNE100004NW4
Beijing AriTime Intelligent Control Co. Ltd. Class A,Technology,600560.SS,EQ,CNE000001CK9
Beijing YJK Building Software Co. Ltd. Class A,Technology,300935.SZ,EQ,CNE100004CS5
Kaiser (China) Culture Co. Ltd. Class A,Technology,002425.SZ,EQ,CNE100000PZ0
Zhongfu Information Inc. Class A,Technology,300659.SZ,EQ,CNE100002NF3
Zhengzhou Tiamaes Technology Co. Ltd Class A,Technology,300807.SZ,EQ,CNE100003QZ2
Dnake (Xiamen) Intelligent Technology Co. Ltd. Class A,Technology,300884.SZ,EQ,CNE1000048N2
Shenzhen Changfang Group Co. Ltd. Class A,Technology,300301.SZ,EQ,CNE100001CV5
Nanjing TDH Technology Co. Ltd. Class A,Technology,301378.SZ,EQ,CNE100006277
Chongqing MAS Science & Technology Co. Ltd. Class A,Technology,300275.SZ,EQ,CNE1000018N5
Shenzhen Longood Intelligent Electronic Co. Ltd. Class A,Technology,300543.SZ,EQ,CNE100002CZ4
Guangdong Anjubao Digital Technology Co. Ltd. Class A,Technology,300155.SZ,EQ,CNE100000YN8
Sublime China Information Co. Ltd. Class A,Technology,301299.SZ,EQ,CNE1000065V9
Gospell Digital Technology Co. Ltd. Class A,Technology,002848.SZ,EQ,CNE100002JY2
Beijing Fjr Optoelectronic Technology Co. Ltd. Class A,Technology,688272.SS,EQ,CNE100005022
Beijing SunwayWorld Science & Technology Co. Ltd. Class A,Technology,301159.SZ,EQ,CNE1000056Z9
Beijing Interact Technology Co. Ltd. Class A,Technology,300419.SZ,EQ,CNE100001YG0
Nanjing Bestway Intelligent Control Technology Co. Ltd. Class A,Technology,301195.SZ,EQ,CNE100005JR9
Chengdu Lihang Technology Co. Ltd. Class A,Technology,603261.SS,EQ,CNE1000059V2
Guangdong Faith Long Crystal Technology Co. Ltd. Class A,Technology,300460.SZ,EQ,CNE100001ZQ6
Qtone Education Group (Guangdong) Co. Ltd. Class A,Technology,300359.SZ,EQ,CNE100001R25
Lootom Telcovideo Network (Wuxi) Co. Ltd. Class A,Technology,300555.SZ,EQ,CNE100002D95
Wuhan Tianyu Information Industry Co. Ltd. Class A,Technology,300205.SZ,EQ,CNE100001245
Lihe Technology (Hunan) Co. Ltd. Class A,Technology,300800.SZ,EQ,CNE100003QT5
BeiJing Seeyon Internet Software Corp. Class A,Technology,688369.SS,EQ,CNE100003NW6
Wisesoft Co. Ltd. Class A,Technology,002253.SZ,EQ,CNE100000C49
Beijing Infosec Technologies Co. Ltd. Class A,Technology,688201.SS,EQ,CNE1000052Q7
ZheJiang Tailin Bioengineering Co. Ltd. Class A,Technology,300813.SZ,EQ,CNE100003S89
Beijing Century Real Technology Co. Ltd. Class A,Technology,300150.SZ,EQ,CNE000001MP7
Hangzhou Huaxing Chuangye Communication Technology Co. Ltd. Class A,Technology,300025.SZ,EQ,CNE100000GG9
